{
  "author": "isamu",
  "slug": "lens",
  "version": "1.1.0",
  "title": "カメラのレンズ",
  "description": "所有・気になっているカメラレンズを記録するコレクション。焦点距離・F値・マウント・対応フォーマットなどのスペックに加え、所有期間テーブルで『出戻り（売って買い直し）・複数本所有・通算収支』も記録できる。焦点距離バー・35mm換算トグル・絞り込みを備えた『図鑑』カスタムビュー（日本語/英語 i18n 対応）で手持ちのレンズ資産を一覧できる。",
  "tags": ["photography", "camera", "gear", "personal"],
  "license": "MIT",
  "dataConsent": true
}
